"Adresse","Occurrences","Meta Description 1","Longueur de la Meta Description 1","Largeur en pixels de la Meta Description 1","Indexabilité","Statut d'indexabilité"
"https://anihome.fr/","1","Garde d'animaux de compagnie à votre domicile        

Passionnés, pros  

Anihome est votre service de garde d’animaux de compagnie à domicile à Courthézon, près de Orange, dans le Vaucluse.

Nous sommes Pierre et Wendy, passionnés et professionnels des animaux, et nous prenons soin de votre compagnon à quatre pattes","325","1969","Indexable",""
"https://anihome.fr/politique-de-confidentialite/","1","Qui sommes-nous ?



Texte suggéré : L’adresse de notre site est : https://anihome.fr.



Commentaires



Texte suggéré : Quand vous laissez un commentaire sur notre site, les données inscrites dans le formulaire de commentaire, ainsi que votre adresse IP et l’agent utilisateur de votre navigateur sont collectés","325","1863","Indexable",""
"https://anihome.fr/album/","1","Ils ont croisé notre route, une journée ou une vie...    

notre album photo                    

Garde d'animaux professionnelle  
Des dizaines de clients nous font confiance pour","185","928","Indexable",""
"https://anihome.fr/portfolio-items/rongeurs-et-nac/","1","Lapins, hamster, furets, ...  

Vous avez un rongeur ou un nac (nouvel animal de compagnie) et vous cherchez un service de garde à domicile ? Anihome.fr est la solution qu’il vous faut !

Nous vous proposons un service de garde à domicile de rongeurs et nac à Courthézon près de Orange,","290","1745","Indexable",""
"https://anihome.fr/tarifs/","1","Tarifs de base  
Devis définitifs réalisés sur-mesure  

Miaou 

10€ 

à partir de Demander un tarif 

Uniquement pour les chats  

1 à 3 visite(s) par jour
Jusqu'à 3 chats (+2€/chat supp.)
Dimanche et jours fériés +50%
Tarif selon zone géographique  

Ce qui est inclus 

Lavage des gamelles 

Nourrissages 

Renouvellement","346","1867","Indexable",""
"https://anihome.fr/mentions-legales/","1","Adresse du site



L’adresse de notre site est : https://anihome.fr.
Directeur de la publication : Pierre Bultez



Hébergement



Ce site web est hébergé chez OVH Cloud, SAS au capital de 10 174 560 €
RCS Lille Métropole 424 761 419 00045
Code APE 2620Z
N° TVA : FR","282","1598","Indexable",""
"https://anihome.fr/portfolio-items/service-durgences/","1","Les imprévus ça arrive ...  

Vous devez vous absenter en urgence et vous ne savez pas à qui confier votre animal ? Pas de panique, Anihome.fr est là pour vous dépanner !

Nous vous proposons un service d’urgence pour garder vos animaux à domicile, même dans les situations les plus critiques.

Nous","305","1831","Indexable",""
"https://anihome.fr/author/mowgli/","0","","0","0","Indexable",""
"https://anihome.fr/qui-sommes-nous/","1","Pierre et Wendy 

Nous sommes amoureux des animaux, ils font partie de notre vie depuis toujours. Après en avoir recueillis, sauvés, soignés nous avons décidé d'en faire notre métier. 

Garde de vos animaux à votre domicile 

Promenades régulières ou à la demande 

Gratouilles, câlins, caresses, brossage, jeux, ...","324","1887","Indexable",""
"https://anihome.fr/contact/","1","Demander un devis  

Nous intervenons entre-autres sur les communes de Courthézon, Orange, Jonquières, Bedarrides, Chateauneuf du pape, Sarrians, Sorgues, Violès. Détaillez nous votre demande et nous ferons le maximum pour trouver une solution.    

Nous contacter    
Contacter Wendy","289","1747","Indexable",""
"https://anihome.fr/nos-services/","1","Le bien-être des animaux  

Vous cherchez un petsitter de confiance pour garder votre animal de compagnie pendant votre absence ?

Bienvenue sur le site web d’Anihome, votre service de garde d’animaux de compagnie à domicile à Courthézon, près de Orange, dans le Vaucluse.

Nous sommes Pierre et Wendy, un couple passionné et","331","2035","Indexable",""
"https://anihome.fr/actualite/","1","Garde d'animaux professionnelle  
Des dizaines de clients nous font confiance pour garder leur animal de compagnie à Courthézon, Jonquières, Chateauneuf du pape, Orange, Bedarrides, Sorgues, ... Faites comme eux et partez tranquille. Nous contacter","249","1546","Indexable",""
"https://anihome.fr/portfolio-items/reptiles/","1","Pas de discrimination  

Vous avez un reptile et vous cherchez un service de garde à domicile ? Anihome.fr est fait pour vous !

Nous vous proposons un service de garde de reptiles à Courthézon près de Orange, avec un petsitter qualifié et passionné.

Pierre possède et a déjà possédé des reptiles de","306","1803","Indexable",""
"https://anihome.fr/portfolio-items/promenades/","1","Balades de chiens  

Vous cherchez un petsitter de confiance pour promener votre chien ? Vous habitez à Courthézon ou dans les environs, près de Orange dans le Vaucluse ? Vous êtes au bon endroit !

Anihome vous propose un service de promenades de chiens adapté à vos besoins et à ceux de","292","1798","Indexable",""
"https://anihome.fr/actualite/page/2/","1","Garde d'animaux professionnelle  
Des dizaines de clients nous font confiance pour garder leur animal de compagnie à Courthézon, Jonquières, Chateauneuf du pape, Orange, Bedarrides, Sorgues, ... Faites comme eux et partez tranquille. Nous contacter","249","1546","Non indexable","Canonisé"
"https://anihome.fr/portfolio-items/gardiennage/","1","Courrier, plantes, volets, ...  

En plus de prendre soin de vos animaux à domicile, Anihome.fr vous propose de vous aider à sécuriser votre maison pendant votre absence.

Nous pouvons relever votre courrier, arroser vos plantes, ouvrir et fermer vos volets, allumer et éteindre vos lumières, et vérifier que tout est en","324","1896","Indexable",""
"https://anihome.fr/portfolio-items/gardes-a-domicile/","1","Gardes chats, chiens, rongeurs, ...  

Que vous ayez un chat, un chien, un rongeur, un reptile ou tout autre animal de compagnie, vous pouvez compter sur nous pour prendre soin de lui en votre absence.

Nous vous offrons, dans un rayon autour de Courthézon près de Orange, une prestation personnalisée et","308","1870","Indexable",""
"https://anihome.fr/les-meilleurs-endroits-pour-partir-en-vacances-avec-son-animal-de-compagnie/","1","Vamos a la playa  

Vous et votre animal êtes inséparables, même pour des vacances ? Nous vous comprenons et il est vivement conseillé, si vous en avez la possibilité et si celui-ci l'accepte, de partir avec votre compagnon.

Nous allons essayer de vous donner quelques conseils. 

Montagne 

Plage 

Campagne","319","1863","Indexable",""
"https://anihome.fr/comment-choisir-le-meilleur-aliment-pour-son-animal-de-compagnie/","1","Une bonne alimentation est essentielle 

Vous aimez votre animal de compagnie et vous voulez qu’il soit en bonne santé et heureux. Mais savez-vous que la qualité de son pelage dépend en grande partie de son alimentation ?

Dans cet article, nous allons vous expliquer comment une bonne alimentation peut contribuer à rendre","327","1993","Indexable",""
"https://anihome.fr/les-bienfaits-de-la-zootherapie-comment-les-animaux-peuvent-nous-aider-a-aller-mieux/","1","La zoothérapie : des bienfaits méconnus  

La zoothérapie, ou thérapie assistée par l’animal, est une pratique qui utilise le contact avec les animaux pour améliorer la santé physique, mentale et sociale des personnes.

Voici quelques exemples de bienfaits de la zoothérapie :

 	La zoothérapie peut favoriser l’interaction sociale, en créant un","351","2041","Indexable",""
"https://anihome.fr/les-conseils-pour-adopter-un-animal-de-compagnie-dans-un-refuge-comment-bien-le-choisir-et-laccueillir/","1","L'adoption doit être réfléchie et responsable  

Adopter un animal de compagnie dans un refuge est un acte généreux et responsable, qui permet de sauver une vie et de faire un heureux. Mais c’est aussi un engagement à long terme, qui demande de la réflexion, de la préparation, et de l’adaptation.

Voici","308","1835","Indexable",""
"https://anihome.fr/les-astuces-pour-eduquer-son-animal-de-compagnie-comment-lui-apprendre-les-bonnes-manieres/","1","Eduquer son animal est essentiel.  

Éduquer son animal de compagnie est essentiel pour vivre en harmonie avec lui, et pour lui assurer une bonne santé et un bien-être optimal.

Il existe de nombreuses méthodes et techniques pour apprendre à son animal les règles de base, les ordres utiles, et les comportements","316","1894","Indexable",""
"https://anihome.fr/comment-bien-choisir-son-petsitter-quelles-sont-les-reglementations-en-france/","1","Un mode de garde tendance avec de nombreux avantages 

Le pet-sitting est une activité qui consiste à garder des animaux de compagnie chez soi ou chez leurs propriétaires en leur absence. C’est une solution pratique et économique pour les personnes qui voyagent ou qui ont des empêchements et qui ne veulent","309","1920","Indexable",""
"https://anihome.fr/les-idees-de-jeux-et-dactivites-pour-stimuler-son-animal-de-compagnie-comment-le-rendre-heureux-et-en-bonne-sante/","1","La séance de jeux : aussi importante pour l'animal que pour le maître 

Stimuler son animal de compagnie avec des jeux et des activités adaptés à ses besoins et ses envies.

Renforcer le lien, le bien-être, et la santé de l’animal. 

Intelligence 

Socialisation 

Divertissement   

Stimuler son animal de compagnie est","332","1843","Indexable",""
"https://anihome.fr/les-nouvelles-lois-pour-lutter-contre-la-maltraitance-et-labandon-des-animaux-de-compagnie/","1","Il est temps de mettre fin à la maltraitance animale  

La maltraitance et l’abandon des animaux de compagnie sont des fléaux qui touchent chaque année des milliers d’animaux en France. Pour y mettre fin, le législateur a adopté plusieurs mesures visant à renforcer la protection des animaux et à sanctionner","310","1879","Indexable",""
"https://anihome.fr/les-tendances-mode-pour-les-animaux-de-compagnie-comment-les-habiller-avec-style/","1","Pet Fashion Week  

Les animaux de compagnie sont de plus en plus considérés comme des membres de la famille, et leurs propriétaires aiment leur faire plaisir et les mettre en valeur. C’est pourquoi la mode pour les animaux de compagnie est un secteur en plein essor, qui propose des vêtements,","296","1802","Indexable",""
"https://anihome.fr/les-dangers-de-lautomedication-chez-les-animaux-de-compagnie-pourquoi-consulter-un-veterinaire/","1","Automédication : attention !  

L’automédication consiste à utiliser des médicaments sans prescription médicale, que ce soit pour soi-même ou pour son animal. Si cette pratique peut sembler tentante pour soulager un symptôme ou éviter une consultation, elle n’est pas sans risque, surtout pour les animaux de compagnie. Voici quelques raisons","344","2104","Indexable",""
